Code;Catégorie;Dénomination;Unité;Prix HT;Temps estimé (min);Description
CHA-001;Charpente;Forfait coupes divers;F;455;180;
CHA-002;Charpente;Forfait élévateur;F;850;180;
CHA-003;Charpente;Fourniture et pose de charpente traditionnelle;M²;97.75;90;
Charpente;Charpente;Fourniture et pose de chevrons et poutres bois pour réparation de toiture;F;1250;180;
CHA-004;Charpente;Fourniture et pose de couloir Zinc;ML;55.25;45;
CHA-005;Charpente;Fourniture et pose de descentes ALU;ML;29.75;45;
CHA-006;Charpente;Fourniture et pose de faitage posés à sec;ML;42.5;45;
CHA-007;Charpente;Fourniture et pose de fronton ou about de faitage;2;56;60;
CHA-008;Charpente;Fourniture et pose de gouttières ALU;ML;29.75;45;
CHA-009;Charpente;Fourniture et pose de lambris PVC;m²;44;90;
CHA-010;Charpente;Fourniture et pose de lambris PVC en débord de toiture;F;244.8;180;
Charpente;Charpente;Fourniture et pose de liteaux 30x40 support de couverture tuiles;m²;6;90;
CHA-011;Charpente;Fourniture et pose de pare pluie;M²;6.8;90;
CHA-012;Charpente;Fourniture et pose de pare pluie;m²;6.8;90;
CHA-013;Charpente;Fourniture et pose de planches de rives PVC;ML;32;45;
CHA-014;Charpente;Fourniture et pose de planches de rives PVC (uniquement à l'égout);ML;35.7;45;
CHA-015;Charpente;Fourniture et pose de tuile chatière et tuile à douille;U;125;120;
CHA-016;Charpente;Fourniture et pose de tuiles Canal de chez TERREAL;M²;38.25;90;
CHA-017;Charpente;Fourniture et pose de tuiles DC12 de chez TERREAL;m²;44;90;
CHA-018;Charpente;Fourniture et pose de tuiles de rives;ML;42.5;45;
DEM-001;Démolition;Abatage et déssouchage d'arbres;U;500;120;
DEM-002;Démolition;Dépose conduit de cheminée compris évacuation;F;685;180;
DEM-003;Démolition;Dépose de cloture existantes;ml;21;45;
DEM-004;Démolition;Dépose de couverture avec évacuation en décharge;m²;25;90;
DEM-005;Démolition;Dépose de la charpente au droit de la poutre abîmée;F;750;180;
DEM-006;Démolition;Dépose et évacuation carrelage existant;m²;0;90;
DEM-007;Démolition;Dépose et évacuation du doublage existant;m²;15;90;
DEM-008;Démolition;Dépose et évacuation margelle existante;ml;21;45;
DEM-009;Démolition;Dépose gouttière et descente;F;350;180;
DEM-010;Démolition;Dépose menuiserie existante et évacuation;U;50;120;
Démolition;Démolition;Dépose planche de rive et lambris compris évacuation;F;385;180;
DEM-011;Démolition;Sciage du béton;ml;10;45;
Gros-oeuvre;Gros Oeuvre;Acrotères BA;m²;78.4;90;
GO;Gros Oeuvre;Ajustement du niveau de la dalle du local surpresseur comprenant:;u;0;60;
L-001;- le remplissage de la fosse en béton allégé;;u;0;60;
L-002;"- la dalle de compression en béton armé finition lissée en;m2;1500;";;u;0;60;
Gros-œuvre;Gros Oeuvre;Appuis et seuil BA;U;120;120;
Gros-oeuvre;Gros Oeuvre;Appuis et seuil BA;U;108;120;
Gros-oeuvre;Gros Oeuvre;Arase étanche;ml;21.6;45;
Gros-œuvre;Gros Oeuvre;Bande de redressement;U;62.4;120;
GO;Gros Oeuvre;Bêches de blocage du hérisson des zones extérieures (profondeur minimale de 50 cm), comprenant :;u;0;60;
L-003;- le terrassement en rigole avec l'évacuation des terres;;u;0;60;
LE-001;"-le béton armé dosé à 300 kg, y compris le coffrage et les armatures.;ml;10.66;";;u;0;60;
Gros-oeuvre;Gros Oeuvre;Béton de fondation semelles filantes SF40;m3;304.92;60;
GO;Gros Oeuvre;Béton désactivé, travaux comprenant :;u;0;60;
L-004;- lit de sable de 5 d’épaisseur tiré à la règle, roulé et compacté uniformément donnant une forme de pente vers l’extérieur pour évacuation des eaux de pluies;;u;0;60;
T-001;- travaux préparatoires, fourniture et mise en œuvre du béton (couleur des graviers de Garonne) pour une dalle de 8 cm d’épaisseur, compris l'épandage du béton, la vibration du béton, le surfaçage du béton;;u;0;60;
-001;-  la pulvérisation du produit désactivant;;u;0;60;
-002;-  le nettoyage au jet haute pression.;;u;0;60;
C-001;"- confection des joints de retrait moulés dans le béton frais, de 5 mm d'épaisseur minimale sur 1/3 de la hauteur de la dalle par incorporation d'un profilé spécial en plastique.;m2;38;";;u;0;60;
Gros-œuvre;Gros Oeuvre;Béton fondations semellle filantes SF 40;M3;272.64;60;
Gros-oeuvre;Gros Oeuvre;Blocs à bancher VPP;m²;78.4;90;
Gros-œuvre;Gros Oeuvre;Calibric TH VPP;M²;49.6;90;
Gros-oeuvre;Gros Oeuvre;Canalisation EU PVC diam 100 pour évac garage;F;942;180;
GO;Gros Oeuvre;Carottage dalle diamètre 40 mm pour passage d'évacuation EU;U;760;120;
Gros-oeuvre;Gros Oeuvre;Ceinture béton pour pose des margelles;F;840;180;
Gros-oeuvre;Gros Oeuvre;Coffrage, ferraillage, coulage balcon compris IPN;F;2859.5;180;
Gros-œuvre;Gros Oeuvre;Coffres volet roulant intégrés à la maçonnerie;ML;228;45;
GO;Gros Oeuvre;Condamnation de porte par blocs parpaings pleins CF1h00 joints ciment sur arase étanche;m2;34;90;
GO;Gros Oeuvre;Construction d'une cloison séparative en briques de terre cuite, joints ciment, sur arase étanche;U;48;120;
GO;Gros Oeuvre;Construction d'un mur séparatif en blocs de parpaings pleins CF 1h joints ciment sur arase étanche compris réservation pour porte des toilettes.;m2;861.31;90;
GO;Gros Oeuvre;Couche de base en grave naturelle 0/20 sur 0,15 m d'épaisseur, épaisseur moyenne après compactage, exempts d’argile et de débris végétaux.;m2;9;90;
GO;Gros Oeuvre;Couche de fondation en grave alluvionnaire 0/80 sur 0,30 m d'épaisseur, épaisseur moyenne après compactage, compris épandage, réglage, compactage, arrosage éventuel.;m2;16;90;
Gros-oeuvre;Gros Oeuvre;Création de marche accès garage ou rampe;F;427.5;180;
Gros-oeuvre;Gros Oeuvre;Création de rampe accès sur dalle;F;1687.5;180;
Gros-œuvre;Gros Oeuvre;Création de sommier béton pour charpente;F;348;180;
Gros-oeuvre;Gros Oeuvre;Dallage sur terre plein;m2;85;90;
Gros-œuvre;Gros Oeuvre;Décapage -50 cm/ dalle existante;M3;24.96;60;
Gros-oeuvre;Gros Oeuvre;Décapage pour agrandissement de la plage de piscine compris evacuation de terre;m²;15;90;
GO;Gros Oeuvre;Découpe de l'enrobé et sciage des bordures selon plans;m2;50.78;90;
GO;Gros Oeuvre;Démolition de mur de rebouchage épaisseur 20 cm, pour création de porte;m2;108;90;
GO;Gros Oeuvre;Démolition de plots béton de support de surpresseur;Ens.;2000;60;
Gros-oeuvre;Gros Oeuvre;Démotition et évacuation mur existant compris fondation;F;1310.4;180;
GO;Gros Oeuvre;Dépose complète du portail coulissant, portillon et clôture existants sur emprise du projet et évcuation en décharge spécialisée.;Ens.;50.5;60;
GO;Gros Oeuvre;Dépose de cloison et porte de fermeture des toilettes, et du bâti évier et évacuation en décharge spécialisée;Ens.;78;60;
GO;Gros Oeuvre;Dépose des portes tôles des locaux V.O. (portes 1 vantail) et local ménage (porte 2 vantaux) et évacuation en décharges spécialisées;U;48.09;120;
Gros-oeuvre;Gros Oeuvre;Dépose et évacuation de la fosse sceptique;F;295;180;
GO;Gros Oeuvre;Enduit ciment lissé à la taloche sur deux faces;m2;750;90;
Gros-oeuvre;Gros Oeuvre;Enduit d'imperméabilisation;m²;20.7;90;
GO;Gros Oeuvre;Epandage de terre végétale, avec terre mise en dépôt lors des décapages de sol prévus  article ‘Décapage de la terre végétale’ (1.3.1.) du présent lot.;u;0;60;
LA-001;"La répartition de la terre sera faite suivant les prescriptions du Maître d’Œuvre.;Ens;1;";;u;0;60;
Gros-oeuvre;Gros Oeuvre;Evacuation au fossé existant;F;590;180;
GO;Gros Oeuvre;Evacuation des déblais excédentaires de toute nature;Ens;1;60;
Gros-œuvre;Gros Oeuvre;Evacuations de terre avec dumper;M3;68.16;60;
GO;Gros Oeuvre;Fouilles en puits à la tarière;U;1;120;
GO;Gros Oeuvre;Fouilles en tranchées, descendues sur bon sol et hors gel, suivant étude ingénieur béton.;ml;1;45;
Gros-oeuvre;Gros Oeuvre;Fourniture et pose de caniveau à grille;ml;135;45;
Gros-oeuvre;Gros Oeuvre;Fourniture et pose de chapeau béton gris plat;ml;45;45;
Gros-oeuvre;Gros Oeuvre;Fourniture et pose de delta MS;m²;18.9;90;
Gros-oeuvre;Gros Oeuvre;Fourniture et pose de géotextile;m²;8;90;
Gros-oeuvre;Gros Oeuvre;Fourniture et pose de natte drainante;m²;70;90;
Gros-oeuvre;Gros Oeuvre;Fourniture et pose de regard à grille;U;300;120;
GO;Gros Oeuvre;Fourniture et pose de trappe CF1/2h 600x600 mm;U;24;120;
Gros-oeuvre;Gros Oeuvre;Fourniture et pose d'IPN;ml;125;45;
Gros-oeuvre;Gros Oeuvre;Fourniture et pose d'un drain agricole en pied de mur;ml;36.9;45;
GO;Gros Oeuvre;Fourniture et pose d'une porte bois CF 1h00 équipée d'un ferme-porte et compris toute quincaillerie, serrure à condamnation, béquilles et platines et butoir.;U;65;120;
GO;Gros Oeuvre;Fourreaux en PVC-U de 45 x 1,8 avec aiguille de tirage, fournis et posés en extérieur dans tranchée avec enrobage de sable et grillage avertisseur.;ml;1;45;
Gros-oeuvre;Gros Oeuvre;Fourreaux sous dallage;F;328.5;180;
GO;Gros Oeuvre;Gravillonnage, pour marquage tactile composé de gravillons fixés dans résine. Epaisseur inférieure à 10 mm, coloris au choix du maitre d’oeuvre.;U;110;120;
GO;Gros Oeuvre;Longrines coulées en place;ml;20.17;45;
Gros-oeuvre;Gros Oeuvre;Maçonnerie B40;m²;66;90;
Gros-oeuvre;Gros Oeuvre;Mise en œuvre de couche de forme;m²;25;90;
GRO-001;Gros Oeuvre;Mise en place de matériel pour travail en hauteur;F;450;180;
Gros-oeuvre;Gros Oeuvre;Mortier de réparation;m²;28;90;
GO;Gros Oeuvre;Nappe matériaux non tissés ‘géotextile’, type ‘Bidim’ ou équivalent;m2;141;90;
GO;Gros Oeuvre;Percement dans maçonnerie pour création d'une réservation 60x40 cm pour la ventilation haute des locaux V.O.;U;430;120;
Gros-oeuvre;Gros Oeuvre;Plancher poutrelle hourdis béton;m²;94.5;90;
Gros-oeuvre;Gros Oeuvre;Plancher poutrelle hourdis polystèrene;m²;94.5;90;
Gros-oeuvre;Gros Oeuvre;Plus-value bande noyée;F;275;180;
Gros-oeuvre;Gros Oeuvre;Plus-value BRH;F;1071;180;
Gros-oeuvre;Gros Oeuvre;Plus-value chainage périphérique;ml;21.6;45;
Gros-oeuvre;Gros Oeuvre;Plus-value coffrage de rive;F;474;180;
Gros-oeuvre;Gros Oeuvre;Pose et raccordement fosse sceptique compris enrobage grains de riz;F;845;180;
Gros-oeuvre;Gros Oeuvre;Poteau BA  30 x 30 x 180 cm ht;U;525;120;
Gros-oeuvre;Gros Oeuvre;Poutre BA  70 x 60 cm ht;m3;725;60;
GO;Gros Oeuvre;Puits en béton armé pour ancrage potelets métalliques de clôture et portillons;U;19.74;120;
Gros-oeuvre;Gros Oeuvre;PV arase;ml;19.8;45;
Gros-oeuvre;Gros Oeuvre;PV coulage au longue distance;F;750;180;
Gros-œuvre;Gros Oeuvre;PV coulage au longue distance;F;680;180;
Gros-œuvre;Gros Oeuvre;PV planelle brique RP =1,00;ML;15.36;45;
Gros-œuvre;Gros Oeuvre;PV raidisseur horizontal;ML;26.88;45;
Gros-œuvre;Gros Oeuvre;PV raidisseur vertical;ML;24;45;
Gros-œuvre;Gros Oeuvre;PV raidisseur Vertical;ML;24;45;
Gros-œuvre;Gros Oeuvre;Raccordement au réseau principal;F;784;180;
Gros-oeuvre;Gros Oeuvre;Raccordement du drain au réseau existant;F;310.5;180;
Gros-œuvre;Gros Oeuvre;Ragréage finitions et sous enduits;F;360;180;
Gros-oeuvre;Gros Oeuvre;Raidisseur BA;ml;25.2;45;
GO;Gros Oeuvre;Régalage de terre végétale. Travaux comprenant le nivellement du terrain, le cassage des mottes de terre et le d’épierrement suivant besoins, pour obtenir un profil régulier.;Ens;1;60;
Gros-œuvre;Gros Oeuvre;Remblaie périphérique;F;247;180;
Gros-oeuvre;Gros Oeuvre;Remblai périphérique en matériaux noble;F;789.75;180;
Gros-oeuvre;Gros Oeuvre;Remblais des déblais inertes stockés;m3;30;60;
GO;Gros Oeuvre;Repliement du matériel, nettoyage final et évacuation des gravats et déchets en décharges spécialisées, DOE, Notes de calculs, Plans de récolement;F;5.5;180;
GO;Gros Oeuvre;Reprise des feuillures suite à dépose des portes et selon caractéristiques attendues par le lot Menuiseries extérieures - Serrurerie;Ens.;41;60;
Gros-oeuvre;Gros Oeuvre;Reprise du jambage suite dépose;U;100;120;
Gros-œuvre;Gros Oeuvre;Réseaux sous dallage;F;520;180;
Gros-œuvre;Gros Oeuvre;Soubassement B80 ht 40 cm;M²;55.68;90;
Gros-oeuvre;Gros Oeuvre;Sous-enduit de finition extérieur;m²;22.5;90;
GO;Gros Oeuvre;Taille et/ou arrachage et évacuation des arbustes et remise en plantation d'arbustes pour mise en place des clôture rigides;Ens;1;60;
Gros-oeuvre;Gros Oeuvre;Terrassement dallage garage;F;1485;180;
Gros-oeuvre;Gros Oeuvre;Terrassement fondation manuel;F;494.1;180;
Gros-oeuvre;Gros Oeuvre;Terrassement fondation mur;m3;74.34;60;
Gros-œuvre;Gros Oeuvre;Terrassement fondations avec petit engins;M3;140;60;
Gros-œuvre;Gros Oeuvre;Traitement des joints de dilatations;F;194.4;180;
ELE-001;Electricité;Création,fourniture,pose et raccordement de 6;u;0;60;
POI-001;points lumineux en plafonnier commandé par un;;u;0;60;
INT-001;"interrupteur simple allumage;U;230;";;u;0;60;
ELE-002;Electricité;Création,fourniture,pose et raccordement de;u;0;60;
TRO-001;"trois points lumineux commandé par un interrupteur simple;U;170;";;u;0;60;
ELE-003;Electricité;Création,fourniture,pose et raccordement de trois points lumineux en plafonnier commandé par deux;u;0;60;
INT-002;"interrupteur va et vient;U;200;";;u;0;60;
ELE-004;Electricité;Création,fourniture,pose et raccordement d’une prise;u;0;60;
RJ-001;"RJ45 dépuis le tableau de communication;U;150;";;u;0;60;
ELE-005;Electricité;Création, fourniture, pose et raccordement d'une prise USB/USBC;U;130;120;
ELE-006;Electricité;Forfait dépose et mise en sécurité de l’installation existante;U;200;120;
ELE-007;Electricité;Fourniture et pose d’une gaine en attente pour arrivée fibre;U;150;120;
ELE-008;Electricité;Fourniture et pose d'un radiateur à inertie 1000W;U;273;120;
ELE-009;Electricité;Fourniture et pose d'un sèche serviette électrique;U;260;120;
ELE-010;Electricité;Fourniture et pose d'un tableau 4 rangées;F;2225;180;
ELE-011;Electricité;Fourniture, pose et raccordement de 1 applique;U;195;120;
ELE-012;Electricité;Fourniture, pose et raccordement de 2 points lumineux commandé par 2 interrupteur va et vient;U;312;120;
ELE-013;Electricité;Fourniture, pose et raccordement de 3 points lumineux commandé par 2 interrupteur va et vient;U;338;120;
ELE-014;Electricité;Fourniture, pose et raccordement de  points lumineux commandé par un interrupteur double;U;130;120;
ELE-015;Electricité;Fourniture, pose et raccordement de  points lumineux commandé par un interrupteur va et vient;U;150;120;
ELE-016;Electricité;Fourniture, pose et raccordement de prise de courant 2P +T double;U;169;120;
ELE-017;Electricité;Fourniture, pose et raccordement de prise de courant 2P+T double;U;130;120;
ELE-018;Electricité;Fourniture, pose et raccordement de spots étanche commandé par un interrupteur simple;U;61.43;120;
ELE-019;Electricité;Fourniture, pose et raccordement de spots leds;U;40;120;
ELE-020;Electricité;Fourniture, pose et raccordement d'une prise de courant 2P +T;U;156;120;
ELE-021;Electricité;Fourniture, pose et raccordement d'un point lumineux commandé par prise simple;U;247;120;
ELE-022;Electricité;Fourniture, pose et raccordement d'un point lumineux en applique commandé par un interrupteur simple;U;110;120;
ELE-023;Electricité;Fourniture, pose et raccordement  d'un point lumineux en applique commandé par un interrupteur va et vient;U;150;120;
ELE-024;Electricité;Fourniture,pose et raccordement d’un tableau de;u;0;60;
COM-001;"communication avec emplacement de boxe;U;300;";;u;0;60;
ELE-025;Electricité;Fourniture, tirage d'alimentation pour sèche serviette;U;195;120;
ELE-026;Electricité;Fourniture, tirage d'une alimentation pour VMC;U;195;120;
Mext;Menuiserie Ext;Fourniture de porte d'entrée loison Aluminium 900x2150 mm (modèle à confirmé);U;1725.3;120;
Mext;Menuiserie Ext;Fourniture et pose de moustiquaire PVC 120 x 74 :;u;0;60;
T-002;- Toile en fibre de verre noire;;u;0;60;
C-002;- Couleur profilés : RAL 7016 Satinée;;u;0;60;
E-001;"- Enroulement intérieur;U;172;";;u;0;60;
Mext;Menuiserie Ext;Fourniture et pose de moustiquaire velux;U;230;120;
Mext;Menuiserie Ext;Fourniture menuiserie PVC 120x74 :;u;0;60;
G-001;- Gamme NEO PRESTIGE 2;;u;0;60;
L-005;- Localisation : Cuisine;;u;0;60;
R-001;- RAL 7016;;u;0;60;
P-001;- Pose en applique;;u;0;60;
G-002;- Grille de ventilation auto-régulée 1 sur 2;;u;0;60;
U-001;- Uw = à 1.5W/m².K;;u;0;60;
S-001;- Sw = à 0.48;;u;0;60;
D-001;- Dormant 140;;u;0;60;
V-001;- Vitrage 4/20/4 LowE;;u;0;60;
E-002;- Ensemble du chassis : Vitrage LowE avec intercalaire Warm-Edge + ARGON;;u;0;60;
P-002;- Poignée tombante, coloris alu brossé;;u;0;60;
A-001;"- Avec Pare-empête;U;322;";;u;0;60;
Mext;Menuiserie Ext;Fourniture menuiserie pvc 2500x1150 3 vantaux compris volet extérieur motorisé;U;2297.7;120;
Mext;Menuiserie Ext;Fourniture menuiserie pvc blanc compris volet extérieur motorisé;u;0;60;
LOC-001;"Localisation : Cuisine/ Séjour;U;812.7;";;u;0;60;
Mext;Menuiserie Ext;Fourniture menuiserie pvc blanc;u;0;60;
LOC-002;"Localisation : Sdb/ WC;U;465.75;";;u;0;60;
Mext;Menuiserie Ext;Pose de menuiseries;U;150;120;
Mext;Menuiserie Ext;Pose de menuiseries compris volet;U;245;120;
Mint;Menuiserie Int;Fourniture et pose de blocs portes isoplanes 83 cm x 204 cm compris quincailleries;U;250;120;
Mint;Menuiserie Int;Fourniture et pose de Porte coulissante prépeinte acoustique 43db avec habillage acoustique couvre-joints intégrés et plinthes auto 204 ht x 123 larg;m²;1850;90;
Mint;Menuiserie Int;Réalisation de l'habillage du batî support sanitaire suspendu avec plaque haute dureté HABITO;F;255;180;
Platrerie;Plâtrerie;Fourniture et pose de blocs portes ISOPLANE AMES PLEINES;U;305;120;
Platrerie;Plâtrerie;Fourniture et pose de laine de verre GR32 en  120 mm;m²;21;90;
Platrerie;Plâtrerie;Fourniture et pose de porte coulissante;U;605;120;
Platrerie;Plâtrerie;Fourniture et pose de trappe de visite 30 x 30 laquée blanc;F;125;180;
Platrerie;Plâtrerie;Fourniture et pose d'un isolant alvéolaire hybris en 105 mm R=4,00 K/W;m²;19;90;
Platrerie;Plâtrerie;Fourniture et pose d'un isolant alvéolaire hybris en 60 + 125 mm R=6,10 K/W;m²;19;90;
Platrerie;Plâtrerie;Fourniture et pose d'un isolant laine de verre 200 mm R=6,00 K/W;m²;36;90;
PLA-001;Plâtrerie;Plus value pour plaques hydrofuges Pièces humides;m²;5;90;
PLA-002;Plâtrerie;Plus value pour plaques phonique;m²;7;90;
Platrerie;Plâtrerie;Réalisation de cloison séparative en 100 mm avec pose de plaques de plâtre BA 13 pour pose de porte à galandage;m²;38;90;
Platrerie;Plâtrerie;Réalisation de cloison séparative en 72/48 avec pose de plaques de plâtre BA13 vissées sur ossature métalique compris laine 45 mm;m²;41.5;90;
Platrerie;Plâtrerie;Réalisation de faux plafond suspendu rampant avec pose de BA13 vissées sur ossature métallique R+1;m²;35;90;
Platrerie;Plâtrerie;Réalisation de tête de lit 120 ht x 200 long x 20 cm ép;m²;150;90;
Platrerie;Plâtrerie;Réalisation d'un doublage de mur par pose de plaque de plâtre BA13 vissées sur ossature métallique;m²;41.5;90;
Platrerie;Plâtrerie;Traitement des joints de l'ensemble;m²;5;90;
PLO-001;Plomberie CVC;Création des réseaux de distribution eau chaude et eau froide;U;900;120;
PLO-002;Plomberie CVC;Création des réseaux de distribution eau chaude et eau froide;U;2400;120;
PLO-003;Plomberie CVC;Dépose et pose de la climatisation;F;250;180;
PLO-004;Plomberie CVC;Dispositif alimentation WC et robinet  avec EP cuve :;u;0;60;
C-003;- Compresseur;;u;0;60;
F-001;- Filtre;;u;0;60;
C-004;- Clapet anti-retour;;u;0;60;
F-002;"- Flotteur;U;648;";;u;0;60;
PLO-005;Plomberie CVC;Fourniture bati support et WC suspendu;U;444.15;120;
PLO-006;Plomberie CVC;Fourniture de caniveau encastrable;U;186;120;
PLO-007;Plomberie CVC;Fourniture de receveur de douche 90 x 90;U;253.5;120;
PLO-008;Plomberie CVC;Fourniture d'une paroi de baignoire amovible 105 x 140 cm;U;280;120;
PLO-009;Plomberie CVC;Fourniture d'une paroi de douche;U;280;120;
PLO-010;Plomberie CVC;Fourniture d'un mitigeur evier;U;50;120;
PLO-011;Plomberie CVC;Fourniture d'un robinet de salle de bain;U;50;120;
PLO-012;Plomberie CVC;Fourniture et pose d'un meuble double vasque compris mirroir;U;804.7;120;
PLO-013;Plomberie CVC;Fourniture et pose d'un meuble simple vasque;U;450;120;
PLO-014;Plomberie CVC;Fourniture et pose d'un robinet extérieur;U;245;120;
PLO-015;Plomberie CVC;Fourniture et pose d'un système de VMC simple flux hydro B compris trappe de visite ou Extracteur d'air;U;1650;120;
PLO-016;Plomberie CVC;Fourniture meuble lave main compris mitigeur;U;160;120;
PLO-017;Plomberie CVC;Fourniture mirroir;U;95;120;
PLO-018;Plomberie CVC;Fourniture un ensemble barre de douche;U;155;120;
PLO-019;Plomberie CVC;Fourniture un ensemble barre de douche;U;201.5;120;
PLO-020;Plomberie CVC;Fourniture un ensemble barre de douche support et flexible;U;155;120;
PLO-021;Plomberie CVC;Fourniture WC;U;160;120;
PLO-022;Plomberie CVC;Pose d'élément sanitaire :;u;0;60;
S-002;- Siphon douche;;u;0;60;
P-003;- Pare douche;;u;0;60;
C-005;- Colonne de douche;;u;0;60;
M-001;- Mitigeur;;u;0;60;
M-002;- Meuble vasque;;u;0;60;
W-001;- WC;;u;0;60;
L-006;"- Lave main WC;U;1745;";;u;0;60;
PLO-023;Plomberie CVC;Pose d'éléments sanitaires :;u;0;60;
R-002;- Receveur;;u;0;60;
P-004;- Paroi de douche;;u;0;60;
C-006;- Colonne de douche;;u;0;60;
M-003;- Mitigeur;;u;0;60;
M-004;- Meuble vasque;;u;0;60;
W-002;"- WC;U;2745;";;u;0;60;
PLOMBERIE-CVC;Plomberie CVC;Receveur céramique  l. 80 x L. 80 x h. 5,8 cm Ø de la bonde 90 mm;1;180;60;
Revêtements-sols;Revêtement de sol;Fourniture dalle travertin 1,2 cm ép;m²;31;90;
Revêtements-sols;Revêtement de sol;Fourniture dalle travertin 3 cm ép;m²;0;90;
Revêtements-sols;Revêtement de sol;Fourniture de carrelage 60 x 60 cm;m²;35;90;
Revêtements-sols;Revêtement de sol;Fourniture de carrelage R+1;m²;35;90;
Revêtements-sols;Revêtement de sol;Fourniture de carrelage RDC;m²;35;90;
Revêtements-sols;Revêtement de sol;Fourniture de margelle carrelée 60 x 30 x 2 cm;ml;24;45;
Revêtements-sols;Revêtement de sol;Fourniture d'un parquet contre collé 35€/m² (max);m²;35;90;
Revêtements-sols;Revêtement de sol;Fourniture et pose de plinthes largeur 8cm en médium pré-peintes à bords droits;ml;17.5;45;
Revêtements-sols;Revêtement de sol;Fourniture et pose de ragréage fibré P3 renforcé;m²;15;90;
Revêtements-sols;Revêtement de sol;Fourniture margelle travertin 60 x 33 x 3 cm ép;ml;30;45;
Revêtements-sols;Revêtement de sol;Pose dalle 1,2 cm ép compris jointement;m²;35;90;
Revêtements-sols;Revêtement de sol;Pose dalle 3 cm ép compris jointement;m²;50;90;
Revêtements-sols;Revêtement de sol;Pose du carrelage compris jointement;m²;75;90;
Revêtements-sols;Revêtement de sol;Pose du margelle compris jointement sur dalle existante;ml;28;45;
Revêtements-sols;Revêtement de sol;Pose d'un parquet contre collé en pose flottante;m²;30;90;
Sols;Revêtement de sol;Pose margelle 3 cm ép compris jointement;m²;20;90;
Revêtements-sols;Revêtement de sol;Primaire d'accrochage;m²;2.5;90;
Revêtements-sols;Revêtement de sol;Traitement hydrofuge des dalles;m²;3;90;
REV-001;Revêtement mural;Détapissage complet des supports;m²;11.5;90;
REV-002;Revêtement mural;Peinture mur velours  : Préparation, impression et 2 couches de finition;m²;12;90;
REV-003;Revêtement mural;Peinture plafond velours : Préparation, impression et 2 couches de finition velours;m²;11.5;90;
REV-004;Revêtement mural;Peinture porte à galandage : Préparation, impression et 2 couches de finition;U;70;120;
REV-005;Revêtement mural;Peinture poutre : Préparation, impression et 2 couches de finition;U;250;120;
Revêtements-mural;Revêtement mural;Pose d'un carrelage murale compris encollage et jointement et primaire d'étanchéité pour SDB et WC;F;1745;180;
REV-006;Revêtement mural;Ratissage en 2 passes des supports à l'enduit fin, Ponçage;m²;15.2;90;
RAV-001;Ravalement;Fourniture et pose d'agrafes;F;1390;180;
RAV-002;Ravalement;Lavage avec jet à haute pression;m²;3.5;90;
RAV-003;Ravalement;Mise en œuvre de baguette d'angle de finition;F;845;180;
RAV-004;Ravalement;Ouverture des fissures;F;924;180;
RAV-005;Ravalement;Préparation, application 2 couches de peinture mat façade, couleur approchante;m²;21;90;
RAV-006;Ravalement;Préparation, application d'une couche de fixateur;m²;14;90;
RAV-007;Ravalement;Réalisation de peinture appuis en terre cuite;U;95;120;
RAV-008;Ravalement;Réalisation de peinture sous le porche RAL enduit;F;575;180;
RAV-009;Ravalement;Réalisation d'un enduit monocouche finition gratté sur maison;m²;40;90;
RAV-010;Ravalement;Rebouchage des fissures au mortier fibré de réparation;F;875;180;
ZIN-001;Zinguerie;Fourniture et pose de descente Alu diam 100;ML;30;45;
ZIN-002;Zinguerie;Fourniture et pose de gouttières Alu diam 100;ML;30;45;
ZIN-003;Zinguerie;Réalisation de couloir zinc au droit de la cheminée;F;385;180;
Initiale;Initial;Installation, amené et repli du matériels;F;650;180;
Initiale;Initial;Préparation chantier - Amené et repli du matériels - Déplacement - Etude d'exécution;F;350;180;
Initial;Initial;Réalisation de plans d'exécution;F;5000;180;
SER-001;Serrurerie;Approvisionnement IPE;F;50;180;
SER-002;Serrurerie;Fourniture cornière pour IPE sur mesure;U;49;120;
SER-003;Serrurerie;Fourniture et pose de ratelier à vélo pour 5 emplacements en acier galvanisé compris toutes sujétions de fixation au sol;U;3;120;
SER-004;Serrurerie;Fourniture IPE 140 6 ml;U;114;120;
SER-005;Serrurerie;Pose cornière IPE sous plancher suivant plan implantation;F;494.1;180;
Cloture;Clôture;Fourniture et pose de chapeau plat béton;ML;52;45;
Cloture;Clôture;Fourniture et pose de lattes d'occultation en composite en remplissage des panneaux rigides, ht=1.73 m;ml;110;45;
Serrurerie;Clôture;Fourniture et pose de lattes d'occultation en composite en remplissage des panneaux rigides, ht=1.73 m, comprenant lattes intémédiaires et lattes d'extrémités, réglettes de fixation, lisse haute et triangles aluminium ainsi que toutes sujétions de mise en oeuvre.;ml;15;45;
